<?xml version="1.0" encoding="UTF-8"?>
<editorial xmlns="https://www.w3schools.com"
xmlns:xsi="http://www.w3.org/2001/XMLSchema-instance"
xsi:schemaLocation="https://www.w3schools.com ex2.xsd">
  <libro>
    <titulo>El quinto punto cardinal</titulo>
    <autor>Javier Sachez</autor>
    <premio>Premio de novela Juan José Plans 2017</premio>
    <fechaPublicacion año="2017" />
    <codigoPostal>06253</codigoPostal>
  </libro>
  <libro>
    <titulo>Pantaleón y las visitadoras</titulo>
    <autor>Mario Vargas Llosa</autor>
    <premio>Premio Latinoamericano de Literatura</premio>
    <fechaPublicacion año="1973" />
    <codigoPostal>05683</codigoPostal>
  </libro>
  <libro>
    <titulo>Middletown: A study in american culture</titulo>
    <autor>Robert Lynd</autor>
    <autor>Helen Lynd</autor>
    <premio />
    <fechaPublicacion año="1929" />
    <codigoPostal>08024</codigoPostal>
  </libro>
</editorial>